{
  "presentation_overlay_version": "0.2.0",
  "language": "ko",
  "document_id": "ich_m3_r2",
  "entries": [
    {
      "semantic_id": "ich_m3_r2.sem.summary.document_overview",
      "language": "ko",
      "summary_spec_sha256": "e926d4b671553e6627921f92eb99092386459c04a63819e9faf18183be3d6f8e",
      "facet_dispositions": [
        {
          "facet_id": "ich_m3_r2.sem.facet.section_1_introduction",
          "status": "covered",
          "gap_reason": null
        },
        {
          "facet_id": "ich_m3_r2.sem.facet.section_2_pharmacology_studies",
          "status": "covered",
          "gap_reason": null
        },
        {
          "facet_id": "ich_m3_r2.sem.facet.section_3_toxicokinetic_and_pharmacokinetic_studies",
          "status": "covered",
          "gap_reason": null
        },
        {
          "facet_id": "ich_m3_r2.sem.facet.section_4_acute_toxicity_studies",
          "status": "covered",
          "gap_reason": null
        },
        {
          "facet_id": "ich_m3_r2.sem.facet.section_5_repeated_dose_toxicity_studies",
          "status": "covered",
          "gap_reason": null
        },
        {
          "facet_id": "ich_m3_r2.sem.facet.section_6_estimation_of_the_first_dose_in_human",
          "status": "covered",
          "gap_reason": null
        },
        {
          "facet_id": "ich_m3_r2.sem.facet.section_7_exploratory_clinical_trials",
          "status": "covered",
          "gap_reason": null
        },
        {
          "facet_id": "ich_m3_r2.sem.facet.section_8_local_tolerance_studies",
          "status": "covered",
          "gap_reason": null
        },
        {
          "facet_id": "ich_m3_r2.sem.facet.section_9_genotoxicity_studies",
          "status": "covered",
          "gap_reason": null
        },
        {
          "facet_id": "ich_m3_r2.sem.facet.section_10_carcinogenicity_studies",
          "status": "covered",
          "gap_reason": null
        },
        {
          "facet_id": "ich_m3_r2.sem.facet.section_11_reproduction_toxicity_studies",
          "status": "covered",
          "gap_reason": null
        },
        {
          "facet_id": "ich_m3_r2.sem.facet.section_12_clinical_trials_in_pediatric_populations",
          "status": "covered",
          "gap_reason": null
        },
        {
          "facet_id": "ich_m3_r2.sem.facet.section_13_immunotoxicity",
          "status": "covered",
          "gap_reason": null
        },
        {
          "facet_id": "ich_m3_r2.sem.facet.section_14_photosafety_testing",
          "status": "covered",
          "gap_reason": null
        },
        {
          "facet_id": "ich_m3_r2.sem.facet.section_15_nonclinical_abuse_liability",
          "status": "covered",
          "gap_reason": null
        },
        {
          "facet_id": "ich_m3_r2.sem.facet.section_16_other_toxicity_studies",
          "status": "covered",
          "gap_reason": null
        },
        {
          "facet_id": "ich_m3_r2.sem.facet.section_17_combination_drug_toxicity_testing",
          "status": "covered",
          "gap_reason": null
        }
      ],
      "units": [
        {
          "unit_id": "ich_m3_r2.sem.summary.document_overview.u1",
          "text": "이 지침은 지침의 목적, 약리시험, 독성동태 및 약동학 시험, 급성 독성시험, 반복투여 독성시험, 사람 최초 투여량 산정을 다룬다.",
          "sentence_role": "main_points",
          "evidence_refs": [
            {
              "record_id": "ich_m3_r2.kr.1_1.007",
              "source_unit_id": "ich_m3_r2.su.1_1.001",
              "source_text_sha256": "3e92ddc913cf79519f14727aaaf0431a2d50022ff5b2b18efbe29c503c4b07a8"
            },
            {
              "record_id": "ich_m3_r2.kr.2.002",
              "source_unit_id": "ich_m3_r2.su.2.001",
              "source_text_sha256": "1bd9d717eae0a7f8ff241be23a82dc0db20ae37c2f1130958014f3de471af3c9"
            },
            {
              "record_id": "ich_m3_r2.cond.2.001",
              "source_unit_id": "ich_m3_r2.su.2.001",
              "source_text_sha256": "44f6fa79c830c3a72dc92940b29eb8308fea4e722e778ac2d3bc46f5fd40415c"
            },
            {
              "record_id": "ich_m3_r2.kr.3.001",
              "source_unit_id": "ich_m3_r2.su.3.001",
              "source_text_sha256": "437b2263075e7c8e90d9549e21612e2cfa98d1128811cbfcc7eab47f1affe2dd"
            },
            {
              "record_id": "ich_m3_r2.cond.3.001",
              "source_unit_id": "ich_m3_r2.su.3.001",
              "source_text_sha256": "2af290bd666219b0742c4a87ed27fef6a6e039829713a1c77b241d4eb3eeebf2"
            },
            {
              "record_id": "ich_m3_r2.kr.4.003",
              "source_unit_id": "ich_m3_r2.su.4.001",
              "source_text_sha256": "4119c1314f16737cab4ea863c532127546b2f52b3fa7d08f03ae0cb5fb6e801d"
            },
            {
              "record_id": "ich_m3_r2.cond.4.001",
              "source_unit_id": "ich_m3_r2.su.4.001",
              "source_text_sha256": "76df23636fe0fc455a6e32c570c262f3c6c3773950a76eae37916f2cb867f79f"
            },
            {
              "record_id": "ich_m3_r2.kr.5_1.002",
              "source_unit_id": "ich_m3_r2.su.5_1.001",
              "source_text_sha256": "c38cc2a04e3109b8f361c97895134ad49d92b4f2500619d3df1371b2a3951877"
            },
            {
              "record_id": "ich_m3_r2.cond.5_1.001",
              "source_unit_id": "ich_m3_r2.su.5_1.001",
              "source_text_sha256": "57aacf4d7df32846de8ac825b6f21c58b05fb2d6bf20e30232751761529de2e4"
            },
            {
              "record_id": "ich_m3_r2.kr.6.003",
              "source_unit_id": "ich_m3_r2.su.6.001",
              "source_text_sha256": "93c97e5b7a7291b16292a421af3337cdc710051d9d89fe6b8c51bac3e691e98a"
            },
            {
              "record_id": "ich_m3_r2.cond.6.001",
              "source_unit_id": "ich_m3_r2.su.6.001",
              "source_text_sha256": "628eba3698e08b0fe65312e6413ec1d2dfd6efe1157a8b53e6030564958645fe"
            }
          ],
          "source_support": "synthesized"
        },
        {
          "unit_id": "ich_m3_r2.sem.summary.document_overview.u2",
          "text": "이 지침은 탐색적 임상시험, 국소 내약성, 유전독성, 발암성, 생식독성 및 소아 집단 임상시험을 다룬다.",
          "sentence_role": "main_points",
          "evidence_refs": [
            {
              "record_id": "ich_m3_r2.kr.7_2.003",
              "source_unit_id": "ich_m3_r2.su.7_2.001",
              "source_text_sha256": "7c52a30fbd7648412deb5d787b5515aae22a67844b8b0f6e0c886fe7b17259d7"
            },
            {
              "record_id": "ich_m3_r2.cond.7_1.001",
              "source_unit_id": "ich_m3_r2.su.7_1.001",
              "source_text_sha256": "644c025d73f2b2b4ab6491bf9fe4f93cd33585ae63e5abcefde7a2fc8eba87ed"
            },
            {
              "record_id": "ich_m3_r2.kr.8.001",
              "source_unit_id": "ich_m3_r2.su.8.001",
              "source_text_sha256": "1f1da7920c4ed60a19ea2c95aa5dc14c40ef72c9a43a25a16650ec17e7e3a448"
            },
            {
              "record_id": "ich_m3_r2.cond.8.001",
              "source_unit_id": "ich_m3_r2.su.8.001",
              "source_text_sha256": "c708cfef54b44876af19d8d20795d204198fd48cc32b806a4d90d5fce6a5291e"
            },
            {
              "record_id": "ich_m3_r2.kr.9.001",
              "source_unit_id": "ich_m3_r2.su.9.001",
              "source_text_sha256": "38389f3aadc3dee9cd2a3bb728bbc33a983868b24a743a43b080a9a00421153b"
            },
            {
              "record_id": "ich_m3_r2.cond.9.001",
              "source_unit_id": "ich_m3_r2.su.9.001",
              "source_text_sha256": "56478e64c05f07fa7ab1ac2b02705bed10d5a224b964bc256d0f6fbcf156dd5d"
            },
            {
              "record_id": "ich_m3_r2.kr.10.001",
              "source_unit_id": "ich_m3_r2.su.10.001",
              "source_text_sha256": "956d59c82c9685c0902d333bdd8462bbbe013e52c560799ef480354e97b6fdb2"
            },
            {
              "record_id": "ich_m3_r2.cond.10.002",
              "source_unit_id": "ich_m3_r2.su.10.001",
              "source_text_sha256": "3a1a8410780f3c7e0da97f962dec79f35fa6f5e5f89f7b0c90a7e8d93720d6d6"
            },
            {
              "record_id": "ich_m3_r2.kr.11_3.004",
              "source_unit_id": "ich_m3_r2.su.11_3.001",
              "source_text_sha256": "6fff46c96202c16c5079b7631a78e083022ef314fcaa895f19c60532766adac5"
            },
            {
              "record_id": "ich_m3_r2.cond.11_1.001",
              "source_unit_id": "ich_m3_r2.su.11_1.001",
              "source_text_sha256": "17fc5ae5593972d9ef0a383b752a356fbe19387399ba04b9a14fb18955de0b0b"
            },
            {
              "record_id": "ich_m3_r2.kr.12.001",
              "source_unit_id": "ich_m3_r2.su.12.001",
              "source_text_sha256": "31b324b11a178f34d008c127c8adb2d80f76ed7409bd459864b20968c4dcdb8a"
            },
            {
              "record_id": "ich_m3_r2.cond.12.001",
              "source_unit_id": "ich_m3_r2.su.12.001",
              "source_text_sha256": "0691f2e7788dc643196417500a9f8e704e8854fbe91fba531c5a51a9c7883e24"
            }
          ],
          "source_support": "synthesized"
        },
        {
          "unit_id": "ich_m3_r2.sem.summary.document_overview.u3",
          "text": "이 지침은 면역독성, 광안전성 시험, 비임상 남용 가능성, 기타 독성시험 및 병용 의약품 독성시험을 다룬다.",
          "sentence_role": "main_points",
          "evidence_refs": [
            {
              "record_id": "ich_m3_r2.kr.13.001",
              "source_unit_id": "ich_m3_r2.su.13.001",
              "source_text_sha256": "5dcd27b5bf7adee1ebb880a44b1c292db98235b372bb0ae9e472b188ab4667e3"
            },
            {
              "record_id": "ich_m3_r2.cond.13.001",
              "source_unit_id": "ich_m3_r2.su.13.001",
              "source_text_sha256": "50e3d032157d3fe10df33802433a53feadb4171ed8620b1ac099d84cbf01a47b"
            },
            {
              "record_id": "ich_m3_r2.kr.14.001",